[
  {"product_id": "PRD-001", "product_name": "Meridian Everyday Checking", "product_family": "retail checking", "product_group": "deposits"},
  {"product_id": "PRD-002", "product_name": "Meridian High-Yield Savings", "product_family": "high-yield savings", "product_group": "deposits"},
  {"product_id": "PRD-003", "product_name": "Meridian Business Advantage Checking", "product_family": "small-business checking", "product_group": "deposits"},
  {"product_id": "PRD-004", "product_name": "Meridian Rewards Card", "product_family": "consumer credit card", "product_group": "cards"},
  {"product_id": "PRD-005", "product_name": "Meridian Auto Loan", "product_family": "auto loan", "product_group": "lending"},
  {"product_id": "PRD-006", "product_name": "Meridian Personal Loan", "product_family": "personal loan", "product_group": "lending"}
]
